{
  "$schema": "https://json-schema.org/draft/2020-12/schema",
  "$id": "https://github.com/crazycola23/team-layer/schemas/finding.schema.json",
  "title": "Reviewer Finding",
  "description": "One thing a reviewer found, stated so that closing it is checkable. Every field answers a question the implementer would otherwise have to ask: which requirement, where, what was observed, what it costs, and what would have to be true to close it. A finding missing any of those is a complaint rather than a work item.\n\nThe severity and status vocabularies are generated from src/ledger.mjs, because `recordReview` checks a decision against its own findings and a value the schema allowed but the ledger did not recognise would slip past every one of those checks.",
  "type": "object",
  "additionalProperties": false,
  "required": ["schemaVersion", "findingId", "severity", "status", "candidateRevision", "requirement", "location", "evidence", "impact", "requiredOutcome"],
  "properties": {
    "schemaVersion": {"const": 1},
    "findingId": {"type": "string", "minLength": 1},
    "severity": {"$ref": "finding-severity.schema.json"},
    "status": {"$ref": "finding-status.schema.json"},
    "candidateRevision": {"$ref": "git-revision.schema.json"},
    "requirement": {"type": "string", "minLength": 1},
    "location": {"type": "string", "minLength": 1},
    "evidence": {"type": "string", "minLength": 1},
    "impact": {"type": "string", "minLength": 1},
    "requiredOutcome": {"type": "string", "minLength": 1}
  }
}
